<?xml version="1.0" encoding="UTF-8"?>
<Monitor name="arm" xmlns:xsi="http://www.w3.org/2001/XMLSchema-instance"  emsFolderName="ApplicationRelationshipMappings"  xsi:noNamespaceSchemaLocation="../../../../../../../../ems/Monitor.xsd">
	<MeasurementConfigFilePathProperty/>
	<StringProperty isAdvanced="false" name="_pDbUrl" isEditable="true" label="db_url_arm_label" description="db_url_description" value="jdbc:inetora:&lt;host&gt;:1521:&lt;instance&gt;"/>
	<StringProperty isAdvanced="false" name="_pDbDriverName" isEditable="true" label="driver_name_label" description="driver_name_description" value="com.inet.ora.OraDriver"/>
	<StringProperty isAdvanced="false" name="_pDbUserName" isEditable="true" label="db_user_name_label" description="db_user_name_description"/>
	<PasswordProperty isAdvanced="false" name="_pDbPassword" isEditable="true" label="db_password_label" description="db_password_description"/>
	<TimeDiffProperty/>
	<HiddenStringProperty name="pStartTime" value="-1"/>
	<IntProperty isAdvanced="false" name="pCollected" isEditable="false" value="0" stateOptions="1" label="title_collected_measurements"/>
</Monitor>
